Amata Anangu School,-26.1519932,131.1468276Carlton School,-32.4888505,137.7769913Ernabella Anangu School,-26.2641991,132.1763523Fregon Anangu School,-26.7658821,132.0257195Indulkana Anangu School,-26.8694439,133.3793185Kaurna Plains School,-34.7284694,138.6675264Kenmore Park Anangu School,-26.3231239,132.4447535Koonibba Aboriginal School,-31.9,133.41667Marree Aboriginal School,-29.649445,138.0619765Mimili Anangu School,-27.0163088,132.6771742Murputja Anangu School,-26.1679181,130.1184654Oak Valley Aboriginal School,-31.5009472,131.8241905Oodnadatta Aboriginal School,-27.5480766,135.4477678Pipalyatjara Anangu School,-26.3772478,129.1195144Point Pearce Aboriginal School,-34.416635,137.5011914Raukkan Aboriginal School,-35.4711899,139.3247147Watarru Anangu School,-26.3772478,129.1195144Yalata Anangu School,-31.5009472,131.8241905Allendale East Area School,-37.9994521,140.7117383Ardrossan Area School,-34.4232238,137.9168363Booleroo Centre District School,-32.8812978,138.3506178Burra Community School,-33.677806,138.937886Cambrai Area School,-34.652707,139.2817004Ceduna Area School,-32.13818,133.673369Cleve Area School,-33.7003416,136.4941543Coober Pedy Area School,-29.0134312,134.7498736Coomandook Area School,-35.4742919,139.7033142Cowell Area School,-33.6847398,136.9182886Cummins Area School,-34.2644097,135.7235634East Murray Area School,-34.7391261,140.136566Elliston Area School,-33.6490008,134.8895528Eudunda Area School,-34.1830424,139.0912877Hawker Area School,-31.8884084,138.4252432Jamestown Community School,-33.2033808,138.6103237Kangaroo Inn Area School,-37.3448141,140.2392146Kangaroo Island Community Education,-35.651167,137.63313Kangaroo Island Community Education - Kingscote Campus,-35.651167,137.63313Kangaroo Island Community Education - Parndana Campus,-35.7906626,137.2643597Kangaroo Island Community Education - Penneshaw Campus,-35.7202753,137.9292611Karcultaby Area School,-32.9025192,134.859679Karoonda Area School,-35.0920962,139.8967309Keith Area School,-36.0993722,140.3531433Kimba Area School,-33.1368366,136.4200445Kingston Community School,-36.837413,139.855666Lameroo Regional Community School,-35.3310245,140.5208524Leigh Creek Area School,-30.5923371,138.4027121Lock Area School,-33.5678438,135.7545833Lucindale Area School,-36.9371482,140.359422Maitland Area School,-34.3688261,137.6720791Mannum Community College,-34.9104914,139.3072089Meningie Area School,-35.682713,139.34217Miltaburra Area School,-32.4037598,134.533517Minlaton District School,-34.766049,137.593802Mintabie Area School,-27.3202865,133.3046446Moonta Area School,-34.0684787,137.5934134Mount Compass Area School,-35.3500864,138.6211967Oakbank Area School,-34.9795826,138.8519894Orroroo Area School,-32.7310811,138.6120818Port Broughton Area School,-33.6025851,137.9330945Quorn Area School,-32.3552202,138.0212232Roxby Downs Area School,-30.5617156,136.8963886Streaky Bay Area School,-32.797718,134.204036Swan Reach Area School,-34.5697171,139.5976408Tintinara Area School,-35.882033,140.060377Tumby Bay Area School,-34.3744569,136.1005746Woomera Area School,-31.1996682,136.8254933Wudinna Area School,-33.0454978,135.4625148Yankalilla Area School,-35.4533901,138.3315894Yorketown Area School,-35.0134837,137.646972Blair Athol North School B-7 Children's Centre,-34.8525586,138.595767CaFE Enfield Children's Centre,-34.8659053,138.6046779Cowandilla Children's Centre,-34.9340199,138.5593159Elizabeth Grove Children's Centre,-34.731923,138.6709361Elsie Ey Kindergarten,-34.5781522,138.750107Forbes Children's Centre for Early Chldhd Dev,-34.9773652,138.5573683Gabmididi Manoo Children And Family Centre,-33.0181704,137.5466719Gawler & District College B-12 Children's Centre,-34.6151357,138.7379327Hackham West Children's Centre,-35.1453238,138.5192193il nido Children's Centre,-34.8740073,138.6724121John Hartley School B-7 Children's Centre,-34.6802379,138.67363Kaurna Plains Children's Centre,-34.7284694,138.6675264Keithcot Farm Children's Centre,-34.799999,138.677139Kirton Point Children's Centre,-34.7303302,135.8672506Mark Oliphant College (B-12) Children's Centre,-34.6666323,138.6847908Mount Gambier Children's Centre,-37.8120612,140.7607834Ocean View College Children's Centre,-34.803281,138.493946O'Sullivan Beach Children's Centre,-35.125516,138.479683Parafield Gardens Children's Centre,-34.7839798,138.6152289Park's Children's Centre,-34.860959,138.557306Port Augusta Children's Centre,-32.4889001,137.7769024Pukatja Family Wellbeing Centre,-26.2641991,132.1763523Renmark Children's Centre Inc,-34.1731078,140.7433427Sturt Street Community Preschool,-34.9334478,138.5898059Taikurrendi Children and Family Centre,-35.1374689,138.4802839Tinyeri Children's Centre,-35.132152,139.2837029Trinity Gardens Children's Centre,-34.9093098,138.640183Woodcroft Heights Children's Centre,-35.10665,138.557096Woodville Gardens School B-7 Children's Centre,-34.8640168,138.5522864Reynella East College - High School Campus,-35.0920507,138.5587037Reynella East College - Junior Primary Campus,-35.0894948,138.5545377Reynella East College - Primary Campus,-35.0894948,138.5545377Charles Campbell College,-34.875383,138.67318Clare High School,-33.8204375,138.5947933Eastern Fleurieu R-12 School,-35.258076,138.902312Eastern Fleurieu R-12 School - Ashbourne Campus,-35.2708392,138.7652262Eastern Fleurieu R-12 School - Langhorne Creek Campus,-35.2962499,139.0370062Eastern Fleurieu R-12 School - Milang Campus,-35.4051301,138.97327Eastern Fleurieu R-12 School - Strathalbyn 7-12 Campus,-35.258076,138.902312Eastern Fleurieu R-12 School - Strathalbyn R-6 Campus,-35.256008,138.89905Gawler and District College B-12,-34.6151357,138.7379327Hallett Cove School,-35.0774317,138.5130354Kadina Memorial School,-33.9618656,137.709769Mark Oliphant College (B-12),-34.6666323,138.6847908Ocean View P-12 College,-34.8042902,138.4964568Open Access College,-34.891259,138.635968Open Access College - Port Augusta School of the Air,-32.4956502,137.7836971Paralowie School,-34.7584572,138.6132154Pasadena High School,-34.9923126,138.587263Reynella East College,-35.0894948,138.5545377Seaford 6-12 School,-35.1882077,138.4845388The Heights School,-34.8103189,138.6823646William Light R-12 School,-34.9622861,138.5475533Berri Family Day Care,-34.2848144,140.6028059Central Metro Family Day Care,-34.9119848,138.5501024Elizabeth Family Day Care,-34.7197631,138.6638542Family Day Care - Business & Customer Support Ctr,-34.8644129,138.6049397Maitland Family Day Care,-34.376034,137.672659Mount Gambier Family Day Care,-37.8120612,140.7607834Murray Bridge Family Day Care,-35.12447,139.279177Naracoorte Family Day Care,-36.955737,140.7450455Noarlunga Family Day Care,-35.140476,138.497Port Augusta Family Day Care,-32.4888505,137.7769913Port Lincoln Family Day Care,-34.723768,135.859537Port Pirie Family Day Care,-33.1822007,138.0078513Whyalla Family Day Care,-33.0283256,137.5452003Wudinna Family Day Care,-33.0454978,135.4625148Glossop High School - Middle Campus,-34.2786508,140.5427988Glossop High School - Senior Campus,-34.2731235,140.6072839Norwood Morialta Middle Campus - Morialta,-34.900672,138.6763533Norwood Morialta Senior Campus - Norwood,-34.919278,138.6722879Aberfoyle Park High School,-35.0731575,138.5949309Adelaide High School,-34.9293435,138.5879672Australian Science & Mathematics School,-35.01781,138.571039Balaklava High School,-34.1546838,138.4173704Banksia Park International High School,-34.813555,138.72616Birdwood High School,-34.8202438,138.9551038Blackwood High School,-35.026281,138.60658Bordertown High School,-36.3126283,140.7695302Brighton Secondary School,-35.003649,138.519768Christies Beach HS & Southern Vocational College,-35.1328235,138.4986655Craigmore High School,-34.6897153,138.7013425Edward John Eyre High School,-33.0252401,137.5407445Findon High School,-34.8966445,138.5274715Fremont-Elizabeth City High School,-34.7232624,138.6682033Gladstone High School,-33.2652717,138.3462526Glenunga International High School,-34.9490137,138.6359181Glossop High School,-34.2786508,140.5427988Golden Grove High School,-34.7946988,138.6973466Grant High School,-37.8462911,140.794516Hamilton Secondary College,-34.9974885,138.5574781Heathfield High School,-35.021536,138.712628Henley High School,-34.9161994,138.5004723John Pirie Secondary School,-33.18256,138.008668Kapunda High School,-34.3332407,138.9112202Le Fevre High School,-34.8449292,138.484412Loxton High School,-34.4418367,140.5860799Marden Senior College,-34.891259,138.635968Marryatville High School,-34.9268019,138.6431464Millicent High School,-37.5844787,140.3708567Mitcham Girls High School,-34.9691059,138.6134423Modbury High School,-34.836793,138.698045Mount Barker High School,-35.074275,138.856842Mount Gambier High School,-37.824545,140.7639375Murray Bridge High School,-35.1334483,139.2854968Naracoorte High School,-36.939511,140.7235252Norwood Morialta High School,-34.919278,138.6722879Nuriootpa High School,-34.4701273,139.003304Para Hills High School,-34.8011169,138.6508443Para West Adult Campus,-34.687265,138.664538Parafield Gardens High School,-34.7853,138.617937Penola High School,-37.373611,140.843834Peterborough High School,-32.9783154,138.8329654Port Augusta Secondary School,-32.4937171,137.767973Port Lincoln High School,-34.72463,135.8548763Renmark High School,-34.1699486,140.7459393Riverton and District High School,-34.1578666,138.7531607Roma Mitchell Secondary College,-34.8434214,138.6201451Salisbury East High School,-34.7773434,138.6660189Salisbury High School,-34.756201,138.640673Seaton High School,-34.8848485,138.508657Seaview High School,-35.0291505,138.5455674Stuart High School,-33.0157612,137.5198032Thebarton Senior College,-34.917287,138.563046Underdale High School,-34.919208,138.545142Unley High School,-34.9710016,138.6227476Urrbrae Agricultural High School,-34.9670692,138.6252737Valley View Secondary School,-34.834205,138.657208Victor Harbor High School,-35.5569594,138.6065555Waikerie High School,-34.184688,139.974605Whyalla High School,-33.0399111,137.55663Willunga High School,-35.2610453,138.5534683Windsor Gardens Vocational College,-34.8610728,138.6568063Wirreanda High School,-35.127814,138.534059Woodville High School,-34.8716287,138.5401159Pennington Junior Primary School,-34.8617103,138.5317031Port Lincoln Junior Primary School,-34.7219347,135.8572551Christie Downs Learning Together @ Home,-35.1340912,138.4965457Fleurieu Learning Together @ Home,-35.5569641,138.6153645Inner North Learning Together @ Home,-34.8656613,138.6033839Inner South West Learning Together @ Home,-34.9773652,138.5573683Limestone Coast Learning Together @ Home,-37.6082383,140.3619612Lower Yorke Peninsula Learning Together@Home,-35.0185103,137.6077306Murray Bridge Learning Together @ Home,-35.1397095,139.2829688Northern Learning Together @ Home,-34.687265,138.664538Port Augusta Learning Together@Home,-32.4888505,137.7769913Port Lincoln Learning Together @ Home,-34.7408752,135.8443371Port Pirie and Clare Learning Together @ Home,-33.1853176,137.9912337Whyalla Learning Together @ Home,-33.0283256,137.5452003Adelaide Miethke Kindergarten Occasional Care Ctr,-34.8816155,138.5347145Agnes Goode Kindergarten Occasional Care,-34.9108345,138.627841Aldinga Community Kindergarten Occ Care,-35.2740989,138.4532259Ardrossan & Districts Kindergarten Occasional Care,-34.4253298,137.9134361Bains Road Preschool Occ Care,-35.1146362,138.5422746Barmera Kindergarten Occasional Care,-34.2521908,140.470121Blair Athol North Children's Centre Occ Care,-34.8550689,138.5982725Brinkworth Occasional Care,-33.6890978,138.4043799Burra Occasional Care,-33.678641,138.937981Burton Park Preschool Occ Care,-34.741195,138.5987835Callington Kindergarten Occasional Care,-35.1146695,139.0390724Christie Downs Kindergarten Occ Care,-35.131169,138.491515Christies North Kindergarten Occ Care,-35.1316172,138.4823932Coomandook & Districts Kgn Occasional Care,-35.4742919,139.7033142Coonalpyn & District Kindergarten Occasional Care,-35.6995131,139.8547067Cowandilla Children's Centre Occasional Care,-34.9340199,138.5593159Cowell Occasional Care,-33.6847398,136.9182886Crystal Brook Kindergarten Occ Care,-33.3506105,138.2118658Darlington Kindergarten Occ Care,-35.026424,138.547393Davison Street Occasional Care,-33.019902,137.5380912Dorothy Hughes Occasional Care,-34.7547574,138.6360742Dover Kindergarten Occ Care,-35.0250026,138.5277907Elizabeth East Occasional Care,-34.7249771,138.6795055Elizabeth North CPC Occasional Care,-34.7030062,138.6756238Eudunda Community Preschool Occ Care,-34.1818042,139.1026935Evanston Preschool Occ Care,-34.624573,138.7356173Gladigau Park Kindergarten Occ Care,-37.81336,140.795278Gladstone Occasional Care,-33.268487,138.3591226Glencoe & District Kindergarten Occasional Care,-37.687654,140.6113985Hamley Bridge Occasional Care,-34.3560895,138.6808826Highbury Children's Centre Occ Care,-34.8489836,138.7076736Holden Hill Kindergarten Occasional Care,-34.8538351,138.6716809Ingle Farm Community Kindergarten Occ Care,-34.831146,138.644378John Hartley School Children's Centre Occ Care,-34.6802379,138.67363Kalangadoo Kindergarten Occasional Care,-37.5627273,140.6996118Kapunda Kindergarten Occ Care,-34.3389186,138.9142468Kimba Community Kindergarten Occ Care,-33.138825,136.417479Kirton Point Children's Centre Occasional Care,-34.7303302,135.8672506Klemzig Kindergarten Occ Care,-34.873584,138.640882Kurralta Park Comm Kindergarten Occ Care,-34.946185,138.567313Lake Windemere School CPC Occ Care,-34.7391443,138.6192315Lameroo & District Kindergarten Occasional Care,-35.3310245,140.5208524Lantana Kindergarten Occ Care,-34.7887024,138.6064683Lucy Morice Kindergarten Occ Care,-34.906114,138.607182Lyndoch Valley Occasional Care,-34.6043922,138.8855433Mark Oliphant College CPC Occasional Care,-34.6666323,138.6847908McRitchie Crescent Occasional Care,-33.0226911,137.527575Meadows & Districts Kindergarten Occasional Care,-35.180507,138.758012Melaleuca Park Kindergarten Occasional Care,-37.8382561,140.7905126Michelle DeGaris Memorial Kindergarten Occ Care,-36.9609013,140.7497438Minlaton District ELC Occ Care,-34.7706,137.592065Mitchell Park Kindergarten Occ Care,-35.0119631,138.5646238Morphett Vale Primary School - Occasional Care,-35.1093729,138.5167062Mount Gambier Children's Centre Occasional Care,-37.8120612,140.7607834Mt Pleasant & District Kindergarten Occ Care,-34.775802,139.050672Norrie Stuart Occasional Care,-33.0386703,137.5310539North Haven Kindergarten Occasional Care,-34.7893998,138.4964946Orroroo Occasional Care,-32.7310811,138.6120818Parafield Gardens Children's Ctr Occasional Care,-34.7839798,138.6152289Parks Children's Centre Occasional Care,-34.860959,138.557306Pennington Kindergarten Occ Care,-34.8616417,138.5328748Point Pearce Occasional Care,-34.416635,137.5011914Port Augusta Children's Centre Occasional Care,-32.4888505,137.7769913Port Wakefield Kindergarten Occasional Care,-34.1866339,138.1506231Prospect Kindergarten Occ Care,-34.874039,138.586851Quorn Kindergarten Occasional Care,-32.347995,138.042769Riverview Preschool Centre Occ Care,-34.7677546,138.6140805Sir Thomas Playford Kindergarten Occ Care,-34.7339953,138.658176Strathalbyn Kindergarten Occ Care,-35.2609222,138.8873233Streaky Bay Children's Centre Occ Care,-32.7984074,134.2113536Surrey Downs Occasional Care,-34.8011455,138.7109807Swan Reach Occasional Care,-34.5723155,139.602323Tailem Bend Kindergarten Occ Care,-35.252388,139.456847The Hub Preschool Occ Care,-35.0759061,138.5956506Tinyeri Children's Ctr Occasional Care,-35.132152,139.2837029Torrensville Preschool Centre Occ Care,-34.9184522,138.5564072Trinity Gardens Children's Centre Occasional Care,-34.9093098,138.640183West Lakes Kindergarten & ECC Occ Care,-34.8936291,138.4927876Westport Preschool Occasional Care,-34.855121,138.491278Whyalla Stuart ECC Kindergarten Occ Care,-33.0271522,137.5237072Willsden Childhood Services Centre Occasional Care,-32.508372,137.781486Woodcroft Heights Children's Ctr Occasional Care,-35.10665,138.557096Woodend Children's Centre Occ Care,-35.080261,138.535659Woodside Preschool Playcentre Occ Care,-34.95282,138.877327Wudinna Occasional Care,-33.0433482,135.4616396Adelaide Secondary School of English,-34.8859124,138.5658872Bowden Brompton Community School,-34.894996,138.580116Bowden Brompton Community School - Northern Middle School Campus,-34.7547233,138.6357024Bowden Brompton Community School - Southern Campus,-35.139041,138.4784911Bowden Brompton Community School - Torrens Road Campus,-34.894996,138.580116School of Languages,-34.8858274,138.5654017Warriappendi School,-34.942603,138.57062Youth Education Centre,-34.8301419,138.6027798Youth Education Centre - Cavan Campus,-34.8239132,138.6001461Youth Education Centre - Flexicentre Campus,-34.8553851,138.5832645Youth Education Centre - Goldsborough Campus,-34.8301419,138.6027798Aberfoyle Campus Schools OSHC Incorporated,-35.0666756,138.5957395Aberfoyle Hub Primary School OSHC/Vac,-35.078135,138.594753Adelaide Hills YMCA OSHC/Vac,-35.074917,138.861668Airdale Primary School OSHC/Vac,-33.1853176,137.9912337Alberton Primary School OSHC/Vac,-34.863207,138.511746Aldgate - Mt Lofty Area OSHC,-35.019445,138.74901Aldinga Beach OSHCers/Vac,-35.2677932,138.4730074Allenby Gardens Primary School OSHC,-34.9013794,138.5541168Allendale East OSHC/Vac,-37.9994521,140.7117383Angaston Community OSHC/Vac,-34.5092433,139.0474734Angle Vale PS OSHC/Vac,-34.6443311,138.6459039Annesley Junior School OSHC,-34.942219,138.596905Antonio School OSHC/Vac,-35.1158962,138.5238973Ardtornish Primary School OSHC/Vac - St Agnes,-34.8342763,138.7063369Athelstone Primary School OSHC/Vac,-34.8684412,138.6996361Banksia Park Primary School OSHC/Vac,-34.808908,138.725861Barmera PS OSHC/Vac,-34.2525585,140.4761052Barossa Recreation & Fitness Centre Vacation Care,-34.5229342,138.9941531Belair Primary School OSHC/Vac,-35.0003489,138.6233009Bellevue Heights Primary School OSHC,-35.028943,138.588927Berri Primary School OSHC/Vac,-34.281694,140.5932827Birdwood Primary School OSHC/Vac,-34.8202438,138.9551038Black Forest PS OSHC/Vac,-34.9607527,138.5728988Blackfriars Priory School OSHC/Vac,-34.894854,138.594895Blackwood Primary School OSHC/Vac,-35.026281,138.60658Blakeview Primary School OSHC/Vac,-34.6871626,138.6997819Blyth PS OSHC,-33.8455065,138.4902858Braeview Primary School OSHC/Vac,-35.081621,138.553602Bridgewater PS OSHC/Vac,-35.0048077,138.7613829Brighton Primary School OSHC/Vac,-35.015794,138.523515Brompton PS OSHC/Vac,-34.8943596,138.5824716Burnside Primary School OSHC/Vac,-34.9363057,138.6615973Burra Community School OSHC/Vac,-33.677806,138.937886Burton Primary School OSHC/Vac,-34.741195,138.5987835Callington Primary School OSHC,-35.1146695,139.0390724Calvary Lutheran Primary School OSHC,-35.1364665,138.510797Cedar College Out of School Hours Care,-34.8550678,138.632573Ceduna Community Children's Centre OSHC/Vac,-32.123461,133.676196Charles Campbell College OSHC/Vac,-34.8744182,138.6727389Christ the King School OSHC,-35.0091179,138.5378491Christian Brothers College Junior School OSHC/Vac,-34.9279163,138.6130634Christies Beach PS OSHC/Vac,-35.137963,138.47913Clapham Primary School OSHC/Vac,-34.9940601,138.604347Clare Primary School OSHC/Vac,-33.8410907,138.6167711Clovelly Park Primary School OSHC/Vac,-34.997842,138.567064Coach Road Child Care Centre OSHC at Tat,-35.2206118,138.5231853Cobbler Creek OSHC/Vac - Golden Grove PS,-34.7883024,138.706119Colonel Light Gardens Primary School OSHC/Vac,-34.9875818,138.5969368Coober Pedy Area School OSHC,-29.0134312,134.7498736Copper Coast Sport & Leisure Centre OSHC,-33.959088,137.706158Coromandel Valley PS OSHC/Vac,-35.03334,138.626133Cowandilla Primary School OSHC/Vac,-34.9340199,138.5593159Crafers - Mt Lofty Area OSHC,-34.993392,138.71283Craigburn Primary School OSHC/Vac,-35.0575373,138.6168016Craigmore Christian School OSHC/Vac,-34.707342,138.705623Craigmore YMCA OSHC/Vac,-34.7080269,138.706538Darlington Primary School OSHC/Vac,-35.027195,138.547603Dernancourt Primary School OSHC/Vac,-34.861134,138.672848Dominican School OSHC,-34.83775,138.484356East Adelaide OSHC/Vac,-34.904861,138.62734East Marden Primary School OSHC/Vac,-34.882322,138.65409East Para Primary School OSHC/Vac,-34.8175878,138.6675327East Torrens PS - Kidsfun OSHC/Vac,-34.890069,138.666662Eastern Fleurieu School OSHC/Vac,-35.256008,138.89905Echunga Primary School OSHC/Vac,-35.0771677,138.7973924Eden Hills Primary School OSHC/Vac,-35.0210563,138.5959095Edwardstown Primary School OSHC/Vac,-34.9790572,138.5793374Elizabeth Grove Primary School OSHC,-34.731923,138.6709361Elizabeth North Primary School OSHC/Vac,-34.7030062,138.6756238Elizabeth Special School OSHC - YMCA,-34.7107128,138.6736908Emmaus Catholic School Camp Australia OSHC/Vac,-35.104576,138.557984Emmaus Christian College OSHC,-34.9709989,138.5588617Encounter Lutheran School OSHC/Vac,-35.5278448,138.6365121Enfield Primary School OSHC,-34.8659825,138.6022664Evanston Primary School OSHC,-34.615804,138.734631Fairview Park Primary School OSHC,-34.7983823,138.7304886Flagstaff Hill R-7 School OSHC/Vac,-35.0502981,138.5890338Flaxmill Schools OSHC,-35.1265719,138.5202708Flinders Park Primary School OSHC/Vac,-34.9113922,138.5486558Forbes Primary School OSHC/Vac,-34.9773652,138.5573683Freeling PS OSHC/Vac,-34.4573018,138.8115635Fulham North PS OSHC,-34.9204675,138.5051409Galilee Catholic School OSHC/Vac,-35.2679308,138.4703391Gawler East Primary School OSHC/Vac,-34.5974997,138.7611861Gawler Sport & Community Centre OSHC/Vac,-34.5971871,138.7401892Gidja Club Vacation Care,-34.736496,135.862639Gilles Street Primary School OSHC/Vac,-34.9341567,138.6038272Glen Osmond Primary School OSHC,-34.957803,138.637283Glenelg Primary School OSHC/Vac,-34.9874875,138.5238078Golden Grove Lutheran School OSHC/Vac,-34.7996618,138.6878279Good Shepherd Lutheran Sch - Para Vista OSHC/Vac,-34.828163,138.667223Goodwood Primary School OSHC/Vac,-34.9516454,138.589569Goolwa PS - Southern Fleurieu OSHC/Vac,-35.501262,138.7755212Grange Primary School OSHC/Vac,-34.902423,138.49588Gulfview Heights Primary School OSHC,-34.7919406,138.6677461Gumeracha Primary School OSHC/Vac,-34.8235808,138.8847803Hackham East Primary School OSHC,-35.141617,138.5332069Hahndorf Primary School OSHC/Vac,-35.027748,138.80989Hallett Cove East PS OSHC/Vac,-35.0729953,138.5169364Hallett Cove School OSHC/Vac,-35.0774317,138.5130354Hallett Cove South Primary School OSHC,-35.0838183,138.5047809Hampstead Primary School OSHC,-34.870971,138.626067Happy Valley Primary School OSHC/Vac,-35.0870983,138.5844476Hawthorndene Primary School OSHC/Vac,-35.019731,138.640212Hendon Primary School OSHC/Vac,-34.8729983,138.5114624Hewett Primary School OSHC,-34.57966,138.748284Highbury Primary School OSHC/Vac,-34.8476942,138.7092189Highgate Primary School OSHC/Vac,-34.9636718,138.6236711Hillcrest Primary School OSHC/Vac,-34.8665869,138.6378783Holy Family Catholic School OSHC/Vac,-34.782029,138.610143Imagine Kilburn Kids School Holiday Program,-34.863706,138.589806Immanuel Lutheran Schl Gawler Camp Australia OSHC,-34.596022,138.7525495Immanuel Primary School Camp Australia OSHC,-34.9728127,138.5319124Ingle Farm East Primary School OSHC/Vac,-34.8345345,138.6535787Ingle Farm Primary School OSHC/Vac,-34.8273499,138.6422504Inner North East Adelaide YMCA OSHC/Vac,-34.8943,138.616966Kangarilla/Clarendon OSHC - Kangarilla,-35.0438433,138.6231097Kapunda PS OSHC/Vac,-34.3249259,138.9201938Keithcot Kings OSHC,-34.799999,138.677139Kersbrook Primary School OSHC,-34.7832153,138.8502035KI CC Kingscote OSHC/Vac,-35.650183,137.6350984Kidman Park PS OSHC/Vac,-34.913686,138.525189Kilkenny Primary School OSHC,-34.8913273,138.5539024Kirinari Community School OSHC,-34.950863,138.610781Klemzig Primary School OSHC/Vac,-34.876944,138.63769Largs Bay Primary School OSHC/Vac,-34.8239352,138.4948655Le Fevre Peninsula PS - Nth Haven Schools OSHC,-34.839759,138.495264Linden Park Primary School OSHC/Vac,-34.9481861,138.6456698Littlehampton Primary School OSHC/Vac,-35.0487899,138.8685629Lobethal PS OSHC/Vac,-34.9011769,138.8717647Lockleys North Primary School OSHC/Vac,-34.920681,138.537705Loreto College Junior School OSHC/Vac,-34.927443,138.641174Loxton District Outside School Hours Care Program,-34.4516513,140.568619Lyndoch PS OSHC/Vac,-34.6040902,138.8868673Madison Park Primary School OSHC/Vac,-34.785334,138.6629509Magill School OSHC/Vac,-34.9142033,138.6794766Mark Oliphant College (B-12) OSHC,-34.6666323,138.6847908Marryatville PS - The Red Shed OSHC/Vac,-34.9256779,138.6501329Mawson Lakes School OSHC/Vac,-34.8086732,138.6149237McLaren Flat - Willunga PS OSHC,-35.20409,138.585358McLaren Vale - Willunga PS OSHC,-35.2116315,138.5303386Meadows PS OSHC/Vac,-35.1821629,138.7562536Memorial Oval Primary School OSHC/Vac,-33.0328072,137.5659011Mercedes College OSHC/Vac,-34.976373,138.628606Midway Road Community House Vac,-34.725388,138.680518Minda Incorporated Vacation Care,-35.010595,138.554619Mitcham PS OSHC/Vac,-34.9715659,138.6158827Modbury CPC-7 OSHC/Vac,-34.82599,138.692125Modbury South Primary School OSHC/Vac,-34.8400048,138.6966108Modbury Special School OSHC/Vac,-34.8400048,138.6966108Modbury West School OSHC/Vac,-34.833258,138.676618Moonta Area School OSHC,-34.0684787,137.5934134Morphett Vale East PS OSHC/Vac,-35.1216075,138.5320628Morphett Vale Primary School OSHC,-35.1093729,138.5167062Mount Barker Primary School Combined OSHC/Vac,-35.067736,138.853549Mount Barker South PS OSHC/Vac,-35.0812073,138.8600281Mount Compass Area School OSHC,-35.3500864,138.6211967Mount Pleasant PS OSHC,-34.774438,139.053577